{"finding_id":"CPR-FND-EXAMPLE-001","skill_id":"CPR-02","chapter_id":"CH-EXAMPLE","version_id":"v1","stage":"production_handoff","status":"blocked","risk_level":"high","object_or_file":"chapter package","location":{"locator":"package root","page":null,"object_id":null,"file_id":null},"observed_fact":"Two files could be current and no manifest identifies one.","authority":"CPR-FILE-002","reason":"Current version cannot be selected defensibly.","owner":"production coordinator","next_action":"Confirm current file and record manifest.","confidence":"high","intervention":"BLOCK","release_effect":"block","dependency_ids":[],"response":null,"closure_condition":"Authorized manifest identifies one current clean file.","created_at":"2026-08-13T00:00:00Z","updated_at":"2026-08-13T00:00:00Z"}
